{
  "schema": "axion-codex-trace/v1",
  "caseId": "explore-new-ui",
  "activation": "explicit",
  "lane": "explore",
  "workspace": "/workspace/project",
  "commands": [
    {
      "command": "node /plugin/skills/dk-design/scripts/preflight.mjs --cwd /workspace/project",
      "exitCode": 0
    },
    {
      "command": "node /plugin/bin/dk.mjs design check",
      "exitCode": 0
    },
    {
      "command": "node /plugin/bin/dk.mjs verify --summary",
      "exitCode": 0
    }
  ],
  "writes": [
    {
      "path": "design/direction.json",
      "kind": "update"
    },
    {
      "path": "src/App.tsx",
      "kind": "update"
    },
    {
      "path": ".dk/report.json",
      "kind": "update"
    }
  ],
  "mutations": [
    {
      "kind": "source",
      "summary": "Implemented the selected direction after comparing three complete surfaces."
    },
    {
      "kind": "generated-evidence",
      "summary": "Recorded repository-local verification evidence."
    }
  ],
  "evidence": [
    {
      "kind": "visual",
      "status": "passed",
      "artifact": ".dk/review/final-desktop.png"
    },
    {
      "kind": "verify",
      "status": "passed",
      "artifact": ".dk/report.json"
    }
  ],
  "finalStatus": "passed"
}
